"X.38","2020/07/10","U.S. National Security Panel Reviewing Chinese Investors’ Purchase of Pharma Firm ","Universal Health Services to Pay $122 Million to Settle Billing Investigations","U.S. Virus Deaths Climb as Cases Hit Another Daily Record","Detroit Police Chief Releases Video Showing Suspect Fired on Police ","SEC Rule Proposal Would Slash Number of Investment Managers That Need to Report Quarterly Holdings ","Amazon Reverses Order to Delete TikTok App","Pac-12 Cancels Non-Conference Football Games","Judge Dismisses Helms-Burton Lawsuit Against Carnival ","Judge Halts First Federal Execution in 17 Years","Cinema Chain AMC Inks Financing Deal to Help It Survive Pandemic","Pardon Michael Flynn","The Tempting of Neil Gorsuch","Seattle’s Tax on Job Creation","Alphabet, United, Novavax: Stocks That Defined the Week","Authentic, Simon Win Contest to Lend Money to Brooks Brothers ","U.S. Prepares to Levy Tariffs on French Cosmetics, Handbags ","Sur La Table Gets Court Approval for Fast-Track Bankruptcy Sale","Europe’s Capital of Pain","‘Demagogue’ Review: Bully’s Pulpit","‘Stranger in the Shogun’s City’ Review: A Woman’s Life in Letters","‘The Beginning or the End’ Review: A-Bomb, B-Movie","Lichtenstein’s Nude Buoys Christie's Live-Stream Sale ","Pandemic Forces Japan’s Muji to Put U.S. Stores Into Bankruptcy","‘Empire of the Black Sea’ Review: Unquiet on the Eastern Front","Hard to Have Honest Conversations on Race","Why KIPP Has Retired ‘Work Hard. Be Nice’","Wall Street Has a Bad Record on Inclusivity","Ugly American? Let the IDB Pick Its Own New President","California Wants a Federal Bailout? Tax Reform Must Come First","Shelton Gets a Vote","Notable & Quotable: No Cancel Culture Here","Political Neutrality Is What Made American Newspapers Great","How to Show That Black Lives Really Matter","Media Mogul Byron Allen Pays $27 Million for Contemporary Aspen Mansion","Singapore’s Ruling Party Keeps Hold on Power, but Opposition Gains","New Jersey Looks to Drop ‘Freeholder’ Title for County Officials ","Treasury Yields Climb After Hitting Lowest Levels Since Spring","Traders Bet on Rally for China’s Markets ","Senate Banking Panel Looks to Advance Trump’s Fed Nominees ","B. Wayne Hughes Built a Self-Storage Empire. Now He Wants to Rent You a McMansion. ","Trump Dims Hopes for New China Trade Deal","Stocks Log Modest Weekly Gains","U.K. Reaches $48.6 Million Settlement With Security-Services Company","How to Tell a Real 1959 Gibson Les Paul Guitar From a Fake: A Missing Notebook Holds the Key","Bulgaria and Croatia Take Vital Step Toward Adopting Euro ","Spotify, Tinder, Other Apps Suffer Outages Due to Facebook Glitch ","Labor Agency Officials Quarantine After Meeting With White House Staffer Who Tested Positive for Covid-19 ","Judge Denies Bail for Ex-Green Beret, Son Tied to Ghosn Escape","How Is Rent the Runway Still In Business? The CEO Moved Quickly, Cut Deep. ","The Ultimate Guide to the Best Running Gear for Men and Women","Most Popular News","Recommended Videos","Ample Supplies of Grain Run Up Against Weak Demand ","Trump Casts Wide TV-Ad Net to Shore Up Support","Coronavirus’s Worst Impact on Oil Demand Has Passed, IEA Says ","Fed Discloses More Corporate Bond and ETF Purchases","A Challenger of the Woke ‘Company Policy’","Will Democrats Accept Another Trump Victory?","Tropical Storm Fay Heads Toward New York City ","Canadian Prime Minister Faces Ethics Questions Over Charity Contract","Gardens That Bring Sculpture Into Nature","Trump Postpones New Hampshire Campaign Rally ","File Your Taxes, Even if You Can’t Pay","American Airlines Has Threatened to Cancel Some Boeing 737 MAX Orders","Self-Reflection at Life’s Sunset","Big Seafaring Nations Agree to Open Borders for Crew Changes","Carnival to Shed 13 Ships ","Sweden’s Former Ambassador to China Is Cleared of Wrongdoing","SoFi Makes Second Attempt to Start Its Own Bank","Balkan Countries Thought They Had Beaten Back Coronavirus. Now Infections Are Rampant.","Why Is Mazda’s CX-9 SUV Suddenly Selling Like Purell?","Rashid Johnson: Art ‘Can Be a Problematic Tool’ for Responding to Current Events","Three Questions With UBS’s Jane Schwartzberg About Women and Money ","Jane Goodall Hopes the Coronavirus Pandemic Will Wake People Up","Coronavirus Threatens Syrian Rebel Stronghold ","The NHL and Its Canadian Playoff Extravaganza","Black Lives Matter Targets Los Angeles District Attorney","Learning to Conquer Life’s Crises","Fiction: Screwballs in Hollywood","‘Utopia Avenue’ Review: Dean, Elf, Jasper & Griff","How to Downsize and Declutter Without Sacrificing Things You Love","Messy Breakup Exposes Secret of Britain’s Billionaire Barclay Twins","‘Smells’ and ‘Smellosophy’ Review: What the Nose Knows","Rivian Raises $2.5 Billion as Investors Chase Electric-Car Buzz ","Five Best: Harold Schechter on Crimes Turned Into Novels Turned Into Movies","‘Clean’ and ‘The Clean Body’ Review: Next to Godliness","Mysteries: On the Trail of the Green Man","Children’s Books: Portraits of the Artist","William Dement Diagnosed America as Sleep-Deprived ","Writer Neal Stephenson Thinks We’ve Gotten Dystopia All Wrong","American Politics Used to Be Socially Distant","Senior Pakistan Officials Contract Coronavirus 
		
			","Slick Shoes for a Close-to-Home Summer","How to Wear a Summer Sweater","Soap Makers Are Cleaning Up, but Can’t Get Enough Hand Pumps","A Summer Festival for Cash-Flow Forecasters ","Lawmaker Who Once Taught Chinese Spies Drops Out of Race in New Zealand ","Seoul Mayor’s Legacy Is Layered in Mystery ","Elon Musk Gloats as Rally Drives Tesla Shares to New Heights","For Pensions, Valuing Real Estate Is Tough. Covid-19 Brings New Hurdles.","North Korean Leader’s Sister Casts Doubt on Future of Nuclear Talks ","Dayna Grayson, Rachel Holt Aim to Raise $100 Million for Construct Capital ","Most Popular News","Recommended Videos","Oxy’s Sweetener a Bitter Pill for Warren Buffett ","Indian Bank Hit by Third Huge Fraud","China Auto Sales Bounce Back From Worst-Ever Quarter","What’s Been Good for PCs Has Been Great for Google","China’s Energy Policy Is a Darker Shade of Green","Christian Pulisic: Star Student of English Soccer’s Summer School","Food Delivery’s Next Meals Won’t Come Cheap"
"X.39","2020/07/11","This Black Female Exec Reached the Top. Advisers Are Helping Her Stay There. ","Mueller Defends Prosecution, Conviction of Roger Stone","Federal Government Denies Disaster Aid for Minneapolis Riots","OPEC, Allies Set to Ease Oil Cuts","U.S. Coronavirus Cases Climb in South, West","Trump Commutes Sentence of Roger Stone","Covid-19 Hits Cruise-Ship Crews Hard ","Career Reboot: How an Architect Ended Up Directing at Nickelodeon","What We Know About Children and Covid-19 ","Psychedelic Mushrooms Could Pit D.C. Against Congress ","College Football Powers Are Canceling Games. Small Programs Are Feeling the Pain. ","New York City’s Transit System Faces Unprecedented Financial Reckoning ","Four Ways to Track the Spread of Coronavirus—and Why None of Them Is Perfect    ","Police Wrestle With Surge in Crime in U.S. Cities Amid Defunding Efforts","Pandemic Crushes Garment Industry, the Developing World’s Path Out of Poverty","Covid-19 Cases Jump in Sunbelt Nursing Homes","Crackdown Imperils Western Efforts to Reduce Russia’s Sway in Belarus","As Offices Reopen Amid Coronavirus, Workers Clash Over Masks, Cubicle Barriers and Lysol","Coronavirus Victims Include Health Clinics in Minority Communities","‘Rafaello 1483-1520’ Review: A Renaissance Reappraisal","What You Can Learn From Marcus Stroman’s Intense MLB Workouts","‘Buy Now Pay Later’ Is Having a Moment as Pandemic Changes Shopping Habits ","Bankruptcy Is Better Option for Small Businesses With New Law","The Lockdown’s Lessons for Climate Activism","Coronavirus Barges Back to the Campaign Forefront ","Pepper...and Salt","The Tech Engine at the Heart of Hollywood’s Content Factories","Is It Safe to Visit a Winery Now?","This Is What It Looks Like When a Texas Oil Boom Busts","How to Visit the National Parks Safely in the Summer of Covid-19","Most Popular News","Recommended Videos","This Black Female Exec Reached the Top. Advisers Are Helping Her Stay There. ","Mueller Defends Prosecution, Conviction of Roger Stone","Federal Government Denies Disaster Aid for Minneapolis Riots","OPEC, Allies Set to Ease Oil Cuts","U.S. Coronavirus Cases Climb in South, West","Trump Commutes Sentence of Roger Stone","Covid-19 Hits Cruise-Ship Crews Hard ","Career Reboot: How an Architect Ended Up Directing at Nickelodeon","What We Know About Children and Covid-19 ","Psychedelic Mushrooms Could Pit D.C. Against Congress ","College Football Powers Are Canceling Games. Small Programs Are Feeling the Pain. ","New York City’s Transit System Faces Unprecedented Financial Reckoning ","Four Ways to Track the Spread of Coronavirus—and Why None of Them Is Perfect    ","Police Wrestle With Surge in Crime in U.S. Cities Amid Defunding Efforts","Pandemic Crushes Garment Industry, the Developing World’s Path Out of Poverty","Covid-19 Cases Jump in Sunbelt Nursing Homes","Crackdown Imperils Western Efforts to Reduce Russia’s Sway in Belarus","As Offices Reopen Amid Coronavirus, Workers Clash Over Masks, Cubicle Barriers and Lysol","Coronavirus Victims Include Health Clinics in Minority Communities","‘Rafaello 1483-1520’ Review: A Renaissance Reappraisal","Most Popular News","Recommended Videos","Most Popular News","Recommended Videos","Most Popular News","Recommended Videos","Most Popular News","Recommended Videos","Most Popular News","Recommended Videos","Most Popular News","Recommended Videos","Most Popular News","Recommended Videos","Most Popular News","Recommended Videos","Most Popular News","Recommended Videos","Most Popular News","Recommended Videos","Most Popular News","Recommended Videos","Most Popular News","Recommended Videos","Most Popular News","Recommended Videos","Most Popular News","Recommended Videos","Most Popular News","Recommended Videos","Most Popular News","Recommended Videos","Most Popular News","Recommended Videos","Most Popular News","Recommended Videos","Most Popular News","Recommended Videos","Most Popular News","Recommended Videos","Most Popular News","Recommended Videos","Most Popular News","Recommended Videos","Most Popular News","Recommended Videos","Most Popular News","Recommended Videos","Most Popular News","Recommended Videos","Most Popular News","Recommended Videos","Most Popular News","Recommended Videos","Most Popular News","Recommended Videos","Most Popular News","Recommended Videos","Most Popular News"
"X.40","2020/07/12","Frac-Sand Supplier Hi-Crush Files for Chapter 11 Bankruptcy ","What Does Being an Ally Look Like? Companies Offer Training in Support of Black Colleagues","Poland’s Presidential Election Remains Too Close to Call","MultiPlan to Go Public in Merger With Churchill Capital Entity","When Co-Workers Test Positive for Covid-19: What You Need to Know ","Interns Seek Solutions to Isolation During the Summer of Coronavirus","New York’s Elise Stefanik Is Raising Millions. What Comes Next?","Coronavirus’s Spread Broadens Across U.S.","Trump’s Mt. Rushmore Speech and Response","Tailor Virus Loans to Main Street Businesses","Stocks: The Only Dead-Cat Bounce in Town","Insurers Deserve Good Marks on Covid Cases","The U.S. Did Lead in Libya ","Panama’s Free Press Under Siege","ESPN Suspends Adrian Wojnarowski Over Email","Of Pardons and Presidents","The Goya Paranoia","Another Loan Forgiveness Scheme","Disney World Reopens With Masks and Without Lines","Iran and China Angle for Broad Partnership to Offset U.S. Pressure ","Economy Week Ahead: Industrial Production, GDP and Retail Sales ","Senate Judiciary Committee Chair to Call Mueller to Testify ","Your 2020 Econ Crash Course","‘Hashem Still Has a Plan’","‘The King of Confidence’ Review: Visionary or Opportunist?","Native American Sovereignty Is No Liberal Triumph","Notable & Quotable: Dads","Hedge Fund Chatham Wins Bankruptcy Auction for McClatchy’s Newspapers","U.S. Weighs Limited Options to Punish China Over Hong Kong ","Target, MTV Blocked Ads From News Mentioning ‘George Floyd’ and ‘Protests’ ","Ubisoft Probes Harassment Allegations as Executives Step Down ","Latest Term Shows John Roberts in Command of Shifting Coalitions ","Education Secretary DeVos Renews Call for School Reopening ","The Ideological Corruption of Science","Schools Can Open Safely This Fall","GOP Women Embrace Guns in House Races ","Protesters in Russia’s Far East Call for Putin to Resign","Hundreds of Thousands Vote in Hong Kong Primaries ","Hagia Sophia Has Reverted to a Mosque, Erdogan Says","Are Banks Afraid? Watch How Much They Set Aside for Loan Losses ","New York City’s Restaurants Are All In on Outdoors ","New Surge in Virus Cases Strains U.S. Testing Capacity ","Turkey’s Hagia Sophia Decision Dismays Christians, Neighbors, Curators ","Economics Journals Faulted for Neglecting Race Studies ","Pandemic Tests Role of Higher Education as Recession Buffer","Schools Entrepreneur Chris Whittle Taps PPP Loan of About $2 Million ","Connecticut’s Big Bet on the Suburbs Might Finally Pay Off","Manufacturers Forge Ahead With Tech, R&D Projects, Despite Capex Cuts ","Quit Chrome. Safari and Edge Are Just Better Browsers for You and Your Computer. ","Bank Earnings: Main Street Blues vs. Wall Street Boom ","Most Popular News","Recommended Videos","Fed, Treasury Disagreements Slowed Lending Plan","Here’s an Investment That Perfectly Tracks the Economy ","Why China Isn’t Expected to Power a Global Recovery ","Bollywood Legend Amitabh Bachchan Tests Positive for Covid-19 ","Seven Rules of Zoom Meeting Etiquette From the Pros ","How to Exercise Safely Outdoors in the Heat","Photos of the Week","Do You Dare Switch Jobs in the Coronavirus Economy?","As Covid-19 Vaccine Work Pushes Ahead, Researchers Probe Safety ","Wall Street’s Earnings Forecast: Cloudy With a Chance of Turbulence    ","Virus Surge Pressures Food Supplies","U.S. Locks Down Bases in Okinawa After Coronavirus Outbreak ","China Releases Detained Professor Who Criticized Xi Jinping, Friends Say ","Most Popular News","Recommended Videos","Fed, Treasury Disagreements Slowed Lending Plan","Here’s an Investment That Perfectly Tracks the Economy ","Why China Isn’t Expected to Power a Global Recovery ","Bollywood Legend Amitabh Bachchan Tests Positive for Covid-19 ","Seven Rules of Zoom Meeting Etiquette From the Pros ","How to Exercise Safely Outdoors in the Heat","Photos of the Week","Do You Dare Switch Jobs in the Coronavirus Economy?","As Covid-19 Vaccine Work Pushes Ahead, Researchers Probe Safety ","Wall Street’s Earnings Forecast: Cloudy With a Chance of Turbulence    ","Virus Surge Pressures Food Supplies","U.S. Locks Down Bases in Okinawa After Coronavirus Outbreak ","China Releases Detained Professor Who Criticized Xi Jinping, Friends Say ","Most Popular News","Recommended Videos","Fed, Treasury Disagreements Slowed Lending Plan","Here’s an Investment That Perfectly Tracks the Economy ","Why China Isn’t Expected to Power a Global Recovery ","Bollywood Legend Amitabh Bachchan Tests Positive for Covid-19 ","Seven Rules of Zoom Meeting Etiquette From the Pros ","How to Exercise Safely Outdoors in the Heat","Photos of the Week","Do You Dare Switch Jobs in the Coronavirus Economy?","As Covid-19 Vaccine Work Pushes Ahead, Researchers Probe Safety ","Wall Street’s Earnings Forecast: Cloudy With a Chance of Turbulence    ","Virus Surge Pressures Food Supplies","U.S. Locks Down Bases in Okinawa After Coronavirus Outbreak ","China Releases Detained Professor Who Criticized Xi Jinping, Friends Say ","Most Popular News","Recommended Videos","Fed, Treasury Disagreements Slowed Lending Plan","Here’s an Investment That Perfectly Tracks the Economy ","Why China Isn’t Expected to Power a Global Recovery ","Bollywood Legend Amitabh Bachchan Tests Positive for Covid-19 ","Seven Rules of Zoom Meeting Etiquette From the Pros ","How to Exercise Safely Outdoors in the Heat","Photos of the Week","Most Popular News","Recommended Videos","Most Popular News","Recommended Videos","Most Popular News","Recommended Videos","Most Popular News"
"X.41","2020/07/13","Roger Stone May Not Appeal Conviction Now That His Sentence Has Been Commuted","Fox News’s Tucker Carlson Rejects Writer’s Posts and Critics’ ‘Self-Righteousness’","Los Angeles Public Schools Won’t Open in Fall as Covid-19 Crisis Continues","OPEC Was Under Pressure Even Before Covid-19","Mental Resilience Can Help You Through the Coronavirus Pandemic; Here’s How to Build It.","Ford Reveals New Bronco After 24 Years Off the Market ","Different Wavelengths: Science Finds Hummingbirds See Ultraviolet Light Invisible to Humans ","Tech-Stock Rally Isn’t Out of Juice Just Yet, Analysts Say","U.S. 12-Month Deficit Hits $3 Trillion as Virus Stimulus Spending Soars","Trump’s Niece Wins Legal Battle Over Tell-All Book ","Officials Fear Fire Has Damaged Assault Ship Beyond Repair ","New York Lawmakers to Hold Hearings on Impact of Coronavirus","U.S. Shifts Policy, Rejects Most Chinese Maritime Claims in South China Sea","Bridgewater Loses Claims It Brought Against Ex-Employees","The Case for Reopening Schools","Your Sunny Fiscal Update","New York & Co. Files for Bankruptcy, Will Close All Stores ","When Central Banks Go Green","Rule of Law in the South China Sea","Congress’s Inaction May Halt Immigration","A Way to Curb Chinese Intimidation","Notable & Quotable: Food","‘Butch Cassidy’ Review: The Allure of the Celebrity Outlaw","AOC’s Hill of Beans","Biden’s Foreign-Policy Blast From the Past","Travelport Wants Lenders Blocked From Taking Over Company ","California Pulls Back on Reopening Amid Surge in Virus Cases","New York City Police Officer’s Use of a Taser Is Under Investigation","Billboard Charts to Stop Tallying Music Sold With T-Shirts, Tickets","Jefferies Names Barclays Executive as New Finance Chief","At PepsiCo, Quarantine Snacks Offset Drop in Soda Sales","Tesla Is Now Bigger Than Bank of America and American Express Combined","Body of ‘Glee’ Star Naya Rivera Found at Southern California Lake","Joe Biden’s Search for That Elusive Economic Consensus ","‘The Waterfall II’ by My Morning Jacket Review: A Rush of Inspiration From Years Ago","Two Former Unaoil Managers Convicted on U.K. Bribery Charges ","SoftBank Explores Sale or IPO for Chip Designer Arm Holdings","Blank-Check Boom Gets Boost From Virus ","Stock Rally Loses Steam in Volatile Session","Lenders Oppose Federal Effort to Weaken Housing-Discrimination Rule ","How Schools Can Reopen Safely: Recommendations From Health Experts","Health Experts, Democrats Rally to Fauci’s Defense After White House Criticism ","The Real Power Brokers In China: Those Who Wield the Rubber Stamps","‘RoundAgain’ by Joshua Redman Review: Playing Through Jazz’s Changes","At Disney, Masks Are Required but Ears Are Optional ","New York Pushes Tracking for Visitors  ","Netflix Can’t Afford a Weak Sequel ","Disney Closing Hong Kong Property as Government Looks to Halt Virus ","Silver Soars, Outpacing Recent Gains in S&P 500 and Gold    ","Super PAC University?","Most Popular News","Recommended Videos","EPA to Retain Ozone Standard Set by Obama Administration ","Peacock, NBCUniversal’s New Streaming Service, Joins Crowded Field at Challenging Time","China to Impose Retaliatory Sanctions on GOP Senators Over Xinjiang Penalties ","Democracy Dies in Darkness, but Don’t Blame Trump","New York City Sees Rise in Shootings for Second Straight Weekend","Why I’ll Be on Campus This Fall","Analog Devices to Buy Rival Maxim for Over $20 Billion","Princeton and Wilson’s Good and Bad Deeds","With Biden Plan, No Growth May Look Good","Better Cancer Screening Helps Lives and Cost","Scott’s Police Reform Could Be a Key for GOP","Carnegie Mellon’s New Business Dean Optimistic About School, U.S. ","EU to Respond to China’s Hong Kong Moves","Hong Kong Security Law Prompts Departure of China Fund Adviser","Chip Makers Scale Up Where It Matters ","For Some Black Americans, Therapy Is Gradually Losing Its Stigma ","Last-Minute Litigation Seeks to Block First Federal Execution Since 2003","Designers Reimagine the Brooklyn Bridge Experience ","Russia’s Norilsk Nickel Involved in New Arctic Fuel Spill","Fed's Williams: SOFR Rate System Has Performed Well During Crisis ","New Taliban Attacks Complicate Afghan Peace Process ","Hong Kong Reverts to Coronavirus Shutdowns ","Migrants in Libya Suffer Torture, Abuse in Off-the-Grid Detention, Aid Groups Say ","Tommy Tuberville, Jeff Sessions Face Off in Alabama Senate Primary Runoff","Jumbled Covid-19 Border Rules Baffle Companies, Stymie Tourism","Washington’s NFL Team Drops the Redskins Name","July Isn’t the Same Without a Tour de France","A Massive Compound With Land in New York and Connecticut Asks $49.5 Million","Sirius to Buy Scripps Podcast Unit for at Least $265 Million","A European Manor in the New York Suburbs","Frozen Cocktails Are Hot Sellers as New Yorkers Grab To-Go Drinks ","Biden Offers Plan to Address Racial Inequality ","Late South Korea Mayor’s Accuser Details Allegations","Google to Invest $10 Billion in India ","Will the Art World Ever Be the Same? A Brief Oral History of a Tumultuous Year ","What Maluma Wants for Breakfast Every Day","M.B.A. Programs Debate Dropping GMAT","London Banks Urged to Pay Reparations for Links to Slavery","Confederate Symbolism in the Military Stretches Far Beyond Flags, Base Names ","Why Covid-19 Won’t Stop the New Shadow Banks    ","Don’t Buy an Oil Fund With an Identity Problem ","Demand for Chief Diversity Officers Is High. So Is Turnover.","Mediaocean Buys Marketing Tech Firm as TV and Streaming Converge ","Poland’s Nationalist President Duda Narrowly Wins Second Term","Investors Find New Safe Place to Hide: Chinese Bonds ","Scientists Hoped Summer Temperatures Would Tamp Down Covid-19 Cases. What Happened?","As Covid-19 Cases Surge, Latino Communities Feel the Brunt    ","Manchester City’s Champions League Ban Is Overturned","Attacking the Hong Kong Dollar Makes Little Sense for the U.S.","Chinese Data Center Stock Rally Does Not Compute","Most Popular News","Recommended Videos","Actress Kelly Preston Dies of Cancer at 57","Who’s Excited About Tax Day? The Do-It-Yourself Filers","Pepper...and Salt","Most Popular News","Recommended Videos","Actress Kelly Preston Dies of Cancer at 57","Who’s Excited About Tax Day? The Do-It-Yourself Filers"
