"","Dates","Title 1","Title 2","Title 3","Title 4","Title 5","Title 6","Title 7","Title 8","Title 9","Title 10","Title 11","Title 12","Title 13","Title 14","Title 15","Title 16","Title 17","Title 18","Title 19","Title 20","Title 21","Title 22","Title 23","Title 24","Title 25","Title 26","Title 27","Title 28","Title 29","Title 30","Title 31","Title 32","Title 33","Title 34","Title 35","Title 36","Title 37","Title 38","Title 39","Title 40","Title 41","Title 42","Title 43","Title 44","Title 45","Title 46","Title 47","Title 48","Title 49","Title 50","Title 51","Title 52","Title 53","Title 54","Title 55","Title 56","Title 57","Title 58","Title 59","Title 60","Title 61","Title 62","Title 63","Title 64","Title 65","Title 66","Title 67","Title 68","Title 69","Title 70","Title 71","Title 72","Title 73","Title 74","Title 75","Title 76","Title 77","Title 78","Title 79","Title 80","Title 81","Title 82","Title 83","Title 84","Title 85","Title 86","Title 87","Title 88","Title 89","Title 90","Title 91","Title 92","Title 93","Title 94","Title 95","Title 96","Title 97","Title 98","Title 99","Title 100","Title 101","Title 102","Title 103","Title 104","Title 105","Title 106","Title 107","Title 108","Title 109","Title 110","Title 111"
"temp_aggregate_second","2020/06/01","A Renewed Push in New York to Open Police Disciplinary Records ","Social Media Becomes Battleground for Street Protests ","New York City to Have Curfew as Protests Over George Floyd’s Death Continue","Officials Fear U.S. Protests Will Spread Coronavirus; No New Deaths in Spain","Facebook Employees Stage Virtual Walkout Over Handling of Trump Posts","Fresh Data Shows Heavy Coronavirus Death Toll in Nursing Homes","Reports of Violence Against Journalists Mount as U.S. Protests Intensify","Music Labels Suspend Work in Support of Demonstrations ","Manhattan Stores Prepare for Another Night of Looting ","Don’t Call in the Troops","Dave Patrick Underwood, RIP","Courts Aren’t Financial Clearinghouses","Three New Yorkers Face Federal Charges for Throwing Makeshift Explosives at Police Cars","Taliban and al Qaeda Remain Linked, U.N. Study Says","Stitch Fix to Lay off About 1,400 Employees in California ","The Lancet’s Politicized Science on Antimalarial Drugs","Nursing Homes, Coronavirus and Medicaid","A Tax on Data Could Fix New York’s Budget","Justice Department Adds New Detail to Compliance Evaluation Guidance","Good Policing Saves Black Lives","The World Waits Out Trump","‘Today Sardines Are Not for Sale’ Review: Incident in the Rue de Buci","U.S. Economy Faces Long Recovery From Coronavirus Effects, Experts Say","Census Bureau Says 60.5% of Households Responded to 2020 Count ","Judge Seeks Time to Consider Motion to Dismiss Flynn Case","Protests Derail Comeback for Restaurants, Retailers ","Templar Energy Bankruptcy Leaves Bank Lenders Deep Underwater ","Dollar Slides as Investors Regain Confidence in Global Economy    ","Supreme Court Upholds Puerto Rico Oversight Board ","George Floyd Case Could Be Minnesota AG Keith Ellison’s Defining Moment","Postal Package Deliveries ‘Bogged Down’ With Delays, Backlogs ","New York to Los Angeles—Photos From a Wave of Protests Sparked by George Floyd’s Death","Gun Stocks Surge Past Broader Market ","Fill Up Empty Spaces With Music","The Staying Inside Guide: A Trove of Piano Enchantments","CBO: Economy Could Take Nearly 10 Years to Catch Up After Coronavirus ","South Korea Agrees to Attend G-7; Putin Seeks More Information","Stocks Start Week With Modest Gains","Drivers Take Advantage of Low Gas Prices as States Reopen ","Starbucks Reduces Worker Hours to Reflect Pared-Back Operations","Companies Lock In Low Rates for Future Debt ","Justices Rule on Pension, Immigrant Deportation Cases","Israel Presses Ahead With Plan to Annex Parts of West Bank ","Return to the Road Drives Oil Price to Largest Ever Monthly Gain ","The People Are Ahead of Leaders on Covid-19","POW Tombstones Create Teachable Moment","Home-Made U.S. Chip Technology Is Behind","Puerto Rico as the Answer to Pharmaceutical Security","EPA Changes Some Clean Water Act Rules ","The SAT Can Help Students Realize Their Weaknesses ","Most Popular News","Recommended Videos","New Ebola Cases Found in Congo ","Pep Talk for Politicians?","Jeweler Kendra Scott Discusses Pandemic Business Strategies","Pompeo Declines to Enter Kansas Senate Race","The Protest That Ended Social Distancing","Saudi Arabia, Russia Inch Toward Deal on Postlockdown Oil Cuts","Ward Connerly Rides Again","The German Executive Who Showed Sports How to Come Back","Supreme Court Extends Hunt for $3 Billion in Offshore Madoff Cash","Russia Sets July 1 Vote on Constitution Changes Allowing Putin to Extend His Rule ","School Goes Online. So Do Class Pranks.   ","Two Dead After Shooting at North Dakota Air Base, Military Says","The Week That Could Determine the Future of Baseball","How to Get a Good Property Deal: the Musical ","Neiman Lender Deutsche Bank Says Retailer Breached Loan Terms ","Warnings Surface About System to Disinfect N95 Masks ","Why Are N95 Masks So Important? ","Don’t Expect Pfizer’s Bad Reaction to Last ","Police Playbooks Tested by Nationwide Protests ","The Keys to a Successful Work-From-Home Internship","Buffett-Backed Italian Insurer Is Told to Boost Capital ","Zynga to Buy Turkish Mobile-Game Studio Peak for $1.8 Billion ","Christo Created Fleeting Art From Familiar Landmarks","How Sleep Has Changed in the Pandemic","Hong Kong Police Ban Tiananmen Massacre Vigil ","Trump Faces New Legal Challenge to His Use of Nondisclosure Agreements ","Pope Francis Tightens Vatican Spending Rules to Fight Corruption","‘Bankrupt in Just Two Weeks’—Individual Investors Get Burned by Collapse of Complex Securities","Chicken Soup, Remdesivir and Deep Breaths: How Older Patients Survived Covid-19","When Shocks Multiply, the Effects Usually Last","Tencent Rival NetEase Moves Ahead With Hong Kong Listing","News Outlets Are Liable for Others’ Facebook Comments, Australian Court Rules ","The Six Best-Designed Items of Summer","Colin Kaepernick’s Protest Is Raging Across America","Unrest Poses Fresh Test for Trump","Coty Appoints Chairman Peter Harf as CEO to Spearhead Turnaround","China’s Economy Is Worse Than It Looks","Police, Protesters Clash as Unrest Rages Across U.S.","Can Meal Kits Remain Flavor of the Month? ","Coronavirus-Fueled Freeze on Citizen Oath Ceremonies Threatens Voter Registration ","Coronavirus Prods the U.K. to Consider the Once-Unthinkable: Negative Rates ","It’s No Optical Illusion—U.S. Stocks Really Are Expensive ","Coronavirus Patients Lose Senses of Taste, Smell—and Haven’t Gotten Them Back","Eli Lilly Begins Testing Covid-19 Drug Derived From Blood of Survivor","YouTube’s Chase for Streaming-TV Ad Dollars Faces Hurdles ","Shoppers Can Expect Big Clearance Sales This Summer","Voting by Mail to Face Biggest Test Since Pandemic Started ","Short the Target: The Specialist Funds Betting M&A Deals Won’t Close ","Tips to SEC Surge as Working From Home Emboldens Whistleblowers","Nestlé Loses Fight With Impossible Foods Over Meatless Burger Branding ","Most Popular News","Recommended Videos","Economic Fallout From Coronavirus Begins Across Developing World","China’s Barely Begun Economic Recovery Shows Signs of Stalling ","National Guard Expands Presence Amid Unrest ","Pepper...and Salt","Most Popular News","Recommended Videos","Economic Fallout From Coronavirus Begins Across Developing World"
"X","2020/06/02","Trump Again Threatens to Move Republican Convention","Coronavirus Hit on U.S. Economy Might Linger Until 2029; Cases in India Keep Surging","China’s BYD Gets Extension on $1 Billion California Mask Deal ","Zoom’s Boom Has a Price ","Looters Damage Businesses, Anger Protesters ","Lyft Says Traffic Is Picking Up ","Francisco Partners Raises Nearly $10 Billion for Tech Deals","‘Blackout Tuesday’ Prompts Debate ","Senate Votes to Confirm Stimulus Fund Watchdog ","Tesco CFO to Step Down in April 2021","Tech Group Files Lawsuit Against President’s Social-Media Executive Order ","Last Person to Receive a Civil War-Era Pension Dies ","Time to Take a Semester Off?","Liberal Cities, Radical Mayhem","Families Will No Longer Accompany U.S. Troops on Mideast Tours ","Facebook’s Zuckerberg Defends Decision to Leave Trump Posts Alone ","Mush From Joe Biden","Cuomo, De Blasio Spar Over Handling of New York City Protests ","Zoom Lifts Full-Year Sales Outlook as Coronavirus Boosts Demand ","The Lockdown Tinderbox","Trump’s Good College Try","The Measure of New York’s Coronavirus Devastation","Politicians Serve Orwellian Tennis Rules","Will Lawyers Act With Honor After Covid?","Every Protester Has a Reason","I’ve Never Been So Afraid for America","‘Girl Decoded’ Review: The Soulfulness of a New Machine","At-Home SAT Off the Table for This Year, College Board Says","Forceful Removal of Protesters From Outside White House Spurs Debate ","Grocers, Restaurants Benefit From Hedging Prices of Beef, Pork ","Brazil’s Ex-Justice Minister Says President Has Abandoned Anticorruption Fight ","Contactless Payment on New York City Subway Delayed by Coronavirus","New York City Extends Curfew After Protests and Widespread Looting","NTSB Calls for Cockpit Video Recorders in Helicopters","Neiman Marcus Denies Breaching Terms of Deutsche Bank Loan ","Warner Music, ZoomInfo Poised to Boost IPO Market","Mall Owner CBL Misses Debt Payment, Seeks Renegotiation","Floyd vs. Looters","A Girl’s Anxiety Therapy, Interrupted by Covid-19, Moves to Screens","The Staying Inside Guide: ‘Revelations’ for Trying Times","Ericsson Begins Monitorship Under U.S. Deferred Prosecution Agreement ","Fauci ‘Cautiously Optimistic’ About Coronavirus Vaccine","U.S. Stocks Close Higher Despite Social Unrest","‘Spelling the Dream’ Review: A Long Spell of Dominance","Readers Share Experiences With Prayer: ‘A Way of Making a Complex World Simple’ ","Brands Like Nike and Adidas Speak Out Against Racism. Is It Enough?","China Trumpets Trump’s Attacks on American Protests to Counter Criticism on Hong Kong","As Iran Lifts Its Lockdown, Virus Cases Return to Peak Level","Professor Says He Laundered Money for Colombian with Ties to Maduro Regime ","Wes Unseld, NBA’s Rookie of Year and MVP in 1969, Dies","Most Popular News","Recommended Videos","Gold’s Gym to Check for Higher Bids at Auction ","‘Ricochet’ Review: A Classic Trio, Caught Live in Its Heyday","Schiff Documents, Podcast and Clairvoyance","Cares Act Job Incentives Are Very Destructive","Oil Rallies With Traders Anticipating Supply Cuts ","HIPAA May Nix Some Reopening Proposals","Concrete Buildings Have Green Advantages","Flying Europe’s Subsidy-Friendly Skies","A Broad Array of Sports Stars Rush to Embrace ‘Black Lives Matter’","U.S. Weighs Tariffs Against Nations Seeking to Tax Internet Firms","The Schnauzer Goes in the Sidecar","The Myth of Systemic Police Racism","Hong Kong Sanctions With Teeth","‘Live’ Facebook Protest Videos Drew Millions of Views, but Some Footage Was Years Old","Insurers’ Best Shelter Against Storms Is Price ","U.S. Tightens Squeeze on Venezuela Oil Trade, Blacklisting Four Tanker Owners ","From Michael Bay to Disney: Coronavirus TV and Movies Are Coming","White House Weighs Options for Next Stimulus Bill ","Virus Threatens a Revered Tradition in Cricket—Spit on the Ball ","Customers Return to Campbell’s Soup","Police Acts of Empathy Defuse Some Protest Tension","CEOs and Big Businesses Speak Out on Racism, Police Violence ","Microsoft Takes On Zoom and Slack in a Battle for Your Work Computer","British Pound Climbs on Optimism Over EU Trade Talks    ","Outlook for Poor Nations Is Grim ","New York City Serves Up Meals to Fill in the Gaps","Nicca Ray’s Coming-of-Age Story","Rental-Apartment Operator Greystar Bulks Up ","Travel Ads for the Homebound ","Photos: Adventures on a Russian Motorcycle","Memorial Swells With Thousands Gathering to Grieve—and Unite","Heart Drugs Show Promise With Covid-19 Complications ","China Nudges Banks to Help Small Businesses ","Keep Your AirPods Sanitary—and Super-Stylish","Inside Frank Sinatra’s Personal Address Book","Co-Working Firms Respond to Industry Threat With Joint Safety Effort ","Essential Marijuana Sellers Are a Good Business for Their Landlords ","From Raleigh to Santa Rosa, Unrest Spreads Beyond Big Cities ","Is This Europe’s Berkshire Hathaway?    ","Protests Descend Into Violence Despite Curfews","Ericsson Emerges as 5G Leader After U.S. Bruises Huawei ","Enhanced Healthcare Partners Backs Merger of Medical Staffing Companies ","China Is Finding New Ways to Splash Its Cash in Countries That Don’t Want It    ","Dear America, A Cold War With China Will Be Expensive ","Bain, Cyrus Picked as Top Bidders for Virgin Australia Assets","Cash in the Bank? Lebanese See Sports Cars, Ski Chalets as Safer Investments ","Cleaning Up Toxic Loans Was Meant to Be a Great Investment. Then Coronavirus Hit.","At-Home Covid-19 Testing Arrives, With Accuracy and Access Questions    ","As Amusement Parks Reopen, Will Americans Ride Roller Coasters in a Pandemic?","Pandemic to Jumpstart Spending on Data Tools at Manufacturers","Most Popular News","Recommended Videos","New Computer Chips Could Power AI to Next Level","Ardian Raises $19 Billion for Private-Equity Secondary Haul ","Trump Vows to Send Troops","NYPD Probes Officers Who Drove Police Cars Into Protesters","Pepper...and Salt","Most Popular News","Recommended Videos"
"X.1","2020/06/03","Chicken Industry Executives Indicted on Price-Fixing Charges","Criminal Charges in George Floyd’s Death Set Up Legal Battle","Former Defense Secretary Mattis Says Trump ‘Tries to Divide Us’ ","Senate Approves Bill Extending Paycheck Protection Program ","Officials Discuss Return of Troops From Washington as Administration Mulls a Military Response","Coronavirus Stimulus Funds Are Largely Depleted","U.S. Labor Department Allows Private Equity in 401(k) Plans","Bill Aims to Stop Theft of U.S. University Research by China, Others ","Germany’s Second Coronavirus Stimulus Package Brings Total  Support to €1.3 Trillion","Virginia to Remove Statue of Robert E. Lee in State Capital","The Lancet, HCL and Trump","How WHO Really Feels About China","Unrigging the Poverty Trap","Boris Johnson’s Freedom Lesson","China Cancels Some U.S. Farm Shipments, Maritime Executives Say","Unemployment Bonus Keeps Workers on the Sidelines","MTA Pulls New Subway Cars From Service in New York City ","America’s New Nihilism","The Silent Majority Amid the Violence","Save Your Kids From Covid’s Digital Deluge","‘Why We Drive’ Review: Awake at the Wheel","Hospital That Was Private-Equity Backed Sold to Local Health Network ","Hong Kong’s Forbidden Vigil","A Proactive Approach to Abusive Policing","Security Guards Flooding New York After Looting Binge ","NYPD Commissioner Says Agitators Sow Violence at Protests","Warner Music Shares Surge in Market Debut ","Saudi Arabia, Russia Agree to Extend Production Curbs as Oil Recovers","Stocks Rise as Hopes Build for More Stimulus","‘Chromatica’ by Lady Gaga: An Invitation to Escape Into Disco","In Louisville, Another Police Shooting Inflames Racial Tensions","SUNY Chancellor Leaving Post, Will Head Ohio State University ","Wall Street Firm Will Pay Junior Bankers Not to Work ","‘We Are Freestyle Love Supreme’ Review: Invigoration Through Improvisation","Campbell’s Sales Rise on Coronavirus Buying","Companies Push for More Access to Mail-In Voting","FedEx Adds New Delivery Fees to Manage Strain From Coronavirus","Fed Promised to Buy Bonds but Is Finding Few Takers ","UAW Ex-President Pleads Guilty to Embezzlement, Racketeering Charges","Trump’s Doctor Says President ‘Remains Healthy’ ","Walmart Goes Off Script at Annual Meeting ","‘Everything Is Gone’: Looting Strikes a Second Blow to Reeling Businesses in Minority Neighborhoods","Auto-Parts Supplier APC Files for Bankruptcy ","U.S. Government-Bond Yields Rise","3M Names New CFO to Help Navigate Effects of Coronavirus Pandemic","Regrets, Rod’s Had a Few","Snap Says It Won’t Promote Trump’s Snapchat Account ","Lyft’s Investors Shouldn’t Be Flooring It ","A Painful Economic Reversal of Fortune for African-Americans ","What to Watch: Revisiting Spike Lee’s  ‘Do the Right Thing’","Most Popular News","Recommended Videos","Rosenstein Offers Limited Defense of Russia Probe","D.C. Lets Voters Submit Ballots by Email After Mail Problems ","Fed Expands Municipal-Lending Facility to More Localities","Retailer New York & Co. Warns of Potential Bankruptcy ","Oil Rallies After Saudi Arabia and Russia Agree to Extend Supply Cuts ","From AppleTV+ to Netflix: Stories Focus on African-Americans Chasing the American Dream","Antimalaria Drug Didn’t Protect Against Covid-19 in Latest Study ","Try a Turban: Audrey Hepburn’s Bad-Hair-Day Fix","A British Artist Transformed This London Warehouse Into a Work of Art","A London Warehouse, An Artist’s Blank Canvas","HSBC Throws Support Behind China on Hong Kong Security Law","Huawei Risks Tougher Line From Britain After Latest U.S. Offensive","Israel Shuts Schools as Coronavirus Cases Jump After Reopening ","Seadrill Says Another Bankruptcy Is an Option in Debt Talks","Quibi Asks Senior Executives to Take 10% Pay Cut","Libyan Warlord’s Oil Foray Draws U.S., U.N. Scrutiny","Coronavirus Pandemic Drives Unemployment Up Across U.S. Metro Areas ","Trump, Twitter and True Free Speech or Not","Zen and the Art of Covid-Life Maintenance","The People’s House Can Do Its Job in Person","America’s Economy Is Healing Slowly ","For Black Professionals, Unrest Lays Bare a Balancing Act at Work ","A Global Strategy That Can Appeal to Trump Voters","U.S. Army Can Ensure Domestic Tranquility","Trump Makes Fresh Attempt to Resolve Saudi, Qatar Feud ","Global Services Sector Sees Tentative Pickup as Coronavirus Lockdowns Ease","People Who Type Two Spaces After a Period Just Can’t Win","Davos Meeting Going Ahead Next Year, Says World Economic Forum ","How Rep. Steve King Lost His Seat in the Iowa Primary ","Unemployment Fraud Spreads Across U.S.","How Do Real-Estate Agents Show Homes During Coronavirus? ‘With Extreme Caution.’","Trump, Biden Offer Contrasting Messages on Protesters","Hong Kong Residents Could Be Offered U.K. Citizenship Amid China Standoff","Coronavirus Crisis Dents Salaries, Not Stock Awards, for Many CEOs ","Safety Advice on Commuting to the Office—And Reducing Your Risks Once You’re There ","Scientist Behind Sweden’s No-Lockdown Policy Says It Wasn’t Strict Enough","AMC Theater Chain Raises Doubt on Ability to Stay in Business","Pinterest Accelerates Tech Projects as Pandemic Boosts User Engagement ","How Emily Ratajkowski Starts Her Week Off Right","LVMH Has Reasons to Get Cold Feet Over Tiffany    ","Most U.S. Firms in Hong Kong Say Chinese Law Will Hurt Business ","Emily Ratajkowski’s Five Monday Must-Haves","The NBA Player Who Knew George Floyd Doesn’t Want Anyone to Forget Him","GOP Open to Congressional Role Addressing Concerns Over Police","Miranda July on Her Most Hollywood-Mogul Friend","Three Ways to Stock a Summer Home Bar","Fashion Shows Get High Tech—and Socially Distant  ","How Payday Lenders Target Consumers Hurt by Coronavirus","Unrest Eases as Protests Continue Despite Curfews","Lockdown Winners and Losers Shouldn’t Both Be Rallying","Most Popular News","Recommended Videos","The Risks of Trading Places","The Pandemic Sent 1.5 Billion Children Home From School. Many Might Not Return. ","Can India’s Homegrown Internet Giant Become the Next Facebook?","Stung by Past Mistakes, Eurozone Takes a Page From U.S. to Fight Crisis ","George Floyd’s Hometown of Houston Tries to Unite Through the Tension","Investors Channel Over $150 Billion Into Coronavirus Bonds ","The Nearly Nihilistic Market Rally "
