"X.114","2020/09/24","Covid-19 Vaccine From Novavax to Begin Phase 3 Trial in U.K. ","Breonna Taylor Decision Sparks More Protests as Leaders Urge Calm","President Again Declines to Say He Will Accept Election Result, Questions Reliability of Ballots","Pac-12 Will Play Football After All ","Google, Twitter and Facebook CEOs Threatened With Subpoena ","Extremists Pose a Violent Threat, FBI and DHS Officials Say ","China’s Bonds Win Third Key Index Inclusion ","Senator’s Husband Likely Used Clout in UC Admissions","Jobless Claims Keep Rising in New York, New Jersey ","Palantir Expected to Be Valued at Nearly $22 Billion in IPO","Trump Stokes the Transition Panic","Shakeup of Voice of America, Other Outlets Faulted ","The GOP Lawsuits Fight Back","The College Covid Scare","A Better Housing Rule for Minorities","The Truth About People of Praise","Parts Maker for Boeing 737 MAX Files for Bankruptcy ","Trump’s Team Hunts for Votes in Person; Biden’s Works the Phones","Trump’s Judges Will Bring America Together","Democrats Hold Abortion Rights Hostage","Notable & Quotable: The 1619 Project","‘Gods at Play’ Review: Greatness Revisited","Trump Says Discount Cards Will Soon Be Mailed to Seniors for Prescription Drugs","The Creator’s Calling Card","BMW Settles SEC Charges Over Sales Disclosures for $18 Million ","Getting to Know 2020 Joe","Murder Case Exposes Bail System’s Flaws, Advocates for Abuse Victims Say      ","Keysight Technologies Agrees to Settle Sanctions Case","GOP Pushes Ahead With Plans to Confirm Supreme Court Nominee","Democrats Prepare New Coronavirus Aid Proposal ","U.S. New Coronavirus Cases Edge Lower","Costco’s Sales Get Another Boost From Pandemic Buying","Trump Administration Proposes Clampdown on Open-Ended Student Visas ","Powerful Cardinal Resigns Amid Financial Scandal ","John Legend and Chrissy Teigen Buy Beverly Hills Home for $17.5 Million","Amazon Event: Tech Titan Unveils New Home Drone, Speakers, Gaming Service","Stocks Finish Higher in Another Volatile Session","Testing the Covid Vaccines and Credibility","E.W. Scripps Agrees to Buy ION Media for $2.65 Billion in Berkshire-Backed Deal","Coal Era Is Ending, No Matter Who Governs","JFK Biographies and the Hazard of Being Too Honest","Bill Barr Is Right to Limit Overzealous Prosecutions","Blank-Check Firms Under Regulatory Scrutiny","New York City Council Speaker Corey Johnson Won’t Run for Mayor ","Bestselling Books Week Ended September 19","High Ground and the Low Level of Political Discourse","Adobe Freshens Up Its PDF for Mobile ","Facebook Tightens Rules for Employee Discussions in Internal Groups","New Jersey Lawmakers Pass Budget With Heftier Millionaires Tax","Accusations by Government Reviewer of Bolton Book Play Little Role in Hearing ","Most Popular News","Recommended Videos","‘Enola Holmes’: Detecting a Novel Heroine","‘The Comey Rule’ Review: Steering Through Scandal","‘Kajillionaire’: Lowbrow Larceny","Unemployment Claims Hold at High Level","Senate Democrats Grapple With Progressives’ Supreme Court Demands","What Will Michael Avenatti Say About Amy Coney Barrett?","Could Einstein Get Published Today?","Mary Trump Sues President and His Sister Claiming Fraud, Conspiracy ","Does a Dedicated Workspace Make WFH Life Better?","If You Lose an Election, You Probably Deserve It","Woke Science Is an Experiment Certain to Fail","California’s Ban on New Gas Cars Further Upends Auto Industry","Remote Work: How to Build and Maintain an Office Culture Without an Office","TikTok Owner Puts Deal With Oracle, Walmart in Beijing’s Hands","Gold Prices Hit by Stronger Dollar, Declining Inflation Expectations    ","U.S. TikTok Ban Faces Fast-Track Court Review","Blue Cross Group Settles Antitrust Case for $2.7 Billion","Lawmakers Offer Support for Fed’s New Inflation Strategy ","How Wilco’s Jeff Tweedy Rediscovered Routine in Quarantine","Hong Kong Expats Are Buying Up Luxury Homes From London to Los Angeles","‘A Million Random Digits’ Was a Number-Cruncher’s Bible. Now One Has Exposed Flaws in the Disorder.","It Feels Like Fake and Real Switched Places","CarMax Only Looks Like a Lemon ","China’s 2060 Climate Change Gambit","Eric Trump Must Appear for Deposition Before Election","How Does Biden’s Catholicism Play to a Polarized Electorate?","File-Sharing Company WeTransfer Names First CFO ","U.K. Extends Covid-19 Support to Businesses for Six Months ","We Accept Cash, Card and Sedan ","Israel Tightens Lockdown, Closes Synagogues as Virus Cases Surge ","Treasury Yields Tick Lower After Mixed Economic Data ","North Korea Kills Seoul Official Found in Its Waters","‘Goldberg Variations’ and ‘Mass for the Endangered’ Review: A Baroque Blitz and an Environmental Plea","This Miami Beach Home Is Not Like the Other Ones","Actually, We Will Know a Lot on Election Night ","Spotify Strikes Deal for Movies and TV Shows Based on Podcasts ","Fashion Week Is Actually Happening—at Least in Paris and Milan","Epic, Spotify Form Group to Push for App Store Changes","Movie Theaters Are Counting on James Bond ","Wine Online: These Events Are Actually Worth Your Time","Firms Conduct ‘War Games’ to Prepare for External Threats","After a Radical Rebuild, the Chicago White Sox Are Among Baseball’s Elite","Turkey’s Unexpected Rate Rise Gives Lira a Lift ","The Toyota Land Cruiser That’s Rarer Than a Ferrari","Tesla Stock Slides, Scripps Surges: What to Watch When the Market Opens Today","Rochester Faces Challenges in Overhauling Police Force","Apple Watch Series 6 and SE: Watch Out for the Upsell","The Best Ribs Are Michelada Ribs","The NFL’s Best Running Backs Are Quarterbacks","Europe Fights Second Wave of Covid-19 Without Full-Blown Lockdowns","Most Popular News","Recommended Videos","Supreme Court Vacancy Makes Health Care Leading Issue in 2020 Elections","United to Offer Covid Testing to Some Hawaii-Bound Travelers ","Google Antitrust Suit Looms Over Issues of Search Dominance, Advertising ","Charles Drury, Starting as a Plasterer, Created a Hotel Chain ","Kamala Harris Brings Hollywood Cash to Biden Campaign ","Covid-19 Upended School Schedules, Now Kids Are Showing Up on the Wrong Day","India Seeks Naval Edge as China Penetrates Indian Ocean "
"X.115","2020/09/25","U.S. Coronavirus Cases Rise, and Surpass Seven Million","Judge Removes Trump Public Lands Boss for Serving Unlawfully","Trump Plans to Nominate Amy Coney Barrett to Fill Supreme Court Vacancy","Coronavirus Antibodies Found in Small Portion of Americans, Study Says ","Ex-Deutsche Bank Traders Convicted of Fraud in Market-Manipulation Case","Citigroup Names Next Controller, Accounting Chief","Johnson & Johnson, Nike, Illumina: Stocks That Defined the Week","The FBI’s Bad Intelligence","A Tale of Two Chinese Economies","Andrew Cuomo, Immunization Czar","California’s Electric Autopia","Whistleblower in Orthofix Bribery Case Awarded $1.8 Million","Justice Ruth Bader Ginsburg Lies in State in Capitol","Supreme Court Fight Returns Lindsey Graham to Spotlight ","Google Parent Agrees to Sweeping Workplace Changes in Settlement of Sexual Harassment Suits ","Trump, Biden and the Untimely Death of the Handshake","Fake and Real Russia News","If You Lived in Bristol You’d Be Home by Now","‘Abe: Abraham Lincoln in His Times’ Review: Unruly Genius","The Louvre: Palace as Palimpsest","‘The Daughters of Yalta’ Review: Big Three, Little Three","Science Fiction: Sorcerous Service","American Secures Larger Government Loan After Rivals Reject Cash","Trump’s Drug Discount Cards to Be Funded by a Medicare Trust Fund ","Trump’s Supreme Court Pick to Get Boost From Conservative Groups","Fannie, Freddie Capital Increase Is Endorsed by Risk Panel ","Replying to Harvey Mansfield on Systemic Racism","M.D.s Offer More Than Nurse Practitioners","Ruth Bader Ginsburg Was Friends With Those With Different Views","Turkey Is Not the Aggressor in Dispute With Greece","Apple Suspends Commissions for Apps Offering Paid Online Events","U.S. Stocks Rise, but S&P 500 Notches Fourth Week of Declines","Boeing Board Accused of Lax Oversight Amid 737 MAX Crisis","Trump Points to Handful of Allegedly Discarded Ballots ","Florida Reopens","Caesars, Apollo Size Up U.K.’s William Hill","Drugmaker Mallinckrodt Nears Bankruptcy Filing Over Opioid Suits","On Being Black and Conservative","Notable & Quotable—Durbin to Amy Coney Barrett: ‘Do You Consider Yourself an Orthodox Catholic?’","Johnson & Johnson’s Covid-19 Vaccine Produced Immune Response ","U.S. Asks Judge to Allow WeChat Ban to Proceed ","New York City Might Shut Businesses in Coronavirus Cluster Neighborhoods ","Americans Know More About Civics Than They Did a Year Ago ","LinkedIn Introduces Stories and a Redesign to Create a Friendlier Platform ","FBI Agent Says ‘Get Trump’ Attitude Marred Mueller Probe","The Daughter of a Slave Who Did the Unthinkable: Build a Bank","In a Year of Bad Days, This Was One of the Worst ","Kyle Rittenhouse Attorneys Plan to Fight Extradition to Wisconsin ","Novelist Ali Smith Finds Art for All Seasons","Breonna Taylor Protesters Face Off With Police for Second Night ","Most Popular News","Recommended Videos","Vance, Trump Square Off Over Subpoena at Appellate Court","Russia’s Putin Proposes Noninterference Pact With U.S.","Pompeo to Travel to Mediterranean Countries and Vatican to Bolster Ties ","Two Officials Charged Over Handling of Covid-19 Deaths at Veterans’ Home ","Justice Ruth Bader Ginsburg Is Honored at U.S. Capitol","Depths of Unspoken Emotion","Remington Bet Pits Franklin Against Sandy Hook Families","How to Create a Cozy, Classic American Living Room","The Business and Pleasure of Dining Out","New York City Restaurants Can Permanently Offer Sidewalk, Street Dining ","Gold Scam Targeting Conservatives Raised $180 Million, Regulators Say","IPO Market Parties Like It’s 1999","Sustainable-Bond Market Boosted by Europe’s Top Institutions ","Paris Knife Attack Near Former Charlie Hebdo Office Is Probed as Terrorism","White Kitchens Are Getting Kicked to the Curb","Capital Spending Plays Catch-Up—For Now","Cloud Startups Ride Wave of Pandemic-Fueled Investments","Turbulent 2020 Presidential Campaign Approaches a Storm","China Razed Thousands of Xinjiang Mosques, Report Says","Lynne Cheney’s Journey to the Founding Era","Durable-Goods Orders Rise for Fourth Straight Month","China Evergrande Selloff Deepens as Concern Mounts Over Its Financial Health","Why We Fight So Ferociously Over the Supreme Court","North Korea’s Kim Jong Un Apologizes for Killing of South Korean Official","4 Wildlife Refuges to Visit This Fall—Just You and the Moose","For Engagement Rings, Are Natural Diamonds on the Way Out?","Beijing Frets Over Losing Control of TikTok as It Debates App’s Fate ","Bama Fans Learn About Supply, Demand and Covid-19","How South Korea Successfully Managed Coronavirus","U.K.’s ‘Rule of Six’ for Covid Poses Etiquette Problems. ‘It’s Just Incredibly Awkward.’","Five Best: Peter Toohey on Waiting","‘Jack’ Review: Far From the Fold","‘The Man Who Ran Washington’ Review: Invisible Touch","Mysteries: Copy on Command ","What Americans Really Think About Abortion","Beyond Meat’s Pitch for More Customers: It’s Not Just Good for the Planet, It’s Also Good for You.","Children’s Books: A Sequel to ‘Guess How Much I Love You’","‘The Selected Letters of John Berryman’ Review: Dark Dispatches","Contrarian Money Manager Didn’t Always Bet Against Crowd ","Knut Kloster Helped Create Caribbean Cruise Industry","Olympics Planners Detail Cost Cutting for Tokyo Games ","The Woman in Charge of Getting America Enough Clorox Wipes","‘Filibuster’: A Pirating Maneuver That Sailed Into the U.S. Senate","DraftKings Stock Gains, Novavax Soars: What to Watch When the Market Opens Today","South Africa’s Promise of Racial Equality Falters Under Pandemic ","With Electric-Car Target, California Is Going to Need a Bigger Grid ","Lightning Seek Stanley Cup Redemption After Postseason Failures","Beirut Blast Deepens Miseries of Syrian Refugees in Lebanon ","Apple Faces Prolonged $15 Billion Tax Battle as EU Appeals","Judge Says 2020 Census Must Continue for Another Month","Most Popular News","Recommended Videos","The NBA Playoffs Are Really a Space Race","How the World’s Dullest Market Quietly Created a Synthetic Dollar Empire ","Elena Ferrante’s ‘My Brilliant Friend’ Is Like a Trip to Naples. Only Better.","Roadside Hotels Are Resting Relatively Easy During the Pandemic","The IRS Sets a Trap for Cryptocurrency Tax Cheats ","Brussels Report: Governments’ Concerns Rise About Pandemic Cyberattacks on Health Care ","Investors in Europe Buy Up Stock Funds "
"X.116","2020/09/26","Trump Nominates Amy Coney Barrett to Supreme Court ","What Amy Coney Barrett Could Mean for Future of the Supreme Court","What We Know About Amy Coney Barrett: Views, Opinions and Experience ","Everybody Expects the Anti-Catholic Inquisition","What Kind of Judge Is Amy Coney Barrett?","New York State Tops 1,000 New Virus Cases for First Time Since Early June","During Coronavirus, Every Day Is Take Your Daughter to Work Day","What Equal Opportunity in the Workplace Means","Xi Says China Will Continue Efforts to Assimilate Muslims in Xinjiang ","New York City Rehearsal Spaces Reopen Despite State Restrictions","Everybody vs. the App Store: Why Companies Are Taking Issue With Apple’s Growing Revenue Engine ","In Baseball’s Pandemic Playoffs, the Schedule Could Decide the Pennant ","How WFH Sweatpants Gave Way to Thong Bikinis","Google Will Be Hard Habit to Break ","Biden Holds Bigger September Poll Lead Than Clinton Did ","TikTok’s Fate Coming to a Head","Breonna Taylor Case Prosecutor Known as Republican to Watch","Where Trump and Biden Stand on Trade","How Radiohead Predicted Our Tumultuous Times 20 Years Ago","‘Jacob Lawrence: The American Struggle’ Review: Fiercely Painted Histories","Unhappy With Your Old Life? Pandemic Frees Formerly Office-Bound Workers to Experiment With New Ones","‘Palo Alto’ by Thelonious Monk Review: A Jazz Titan Goes to High School","Inflation Is Already Here—For the Stuff You Actually Want to Buy ","Their Cure for Stress: Family Boxing Workouts","More Homes Are Going Dark as Moratoriums on Utility Shut-Offs End ","The Forgotten Front Porch Is Making a Comeback","Pepper...and Salt","How to Dress for a Zoom Interview, and Other Workwear Dilemmas, Solved","Is It Insane to Start a Business During Coronavirus? Millions of Americans Don’t Think So.","Most Popular News","Recommended Videos","Trump Nominates Amy Coney Barrett to Supreme Court ","What Amy Coney Barrett Could Mean for Future of the Supreme Court","What We Know About Amy Coney Barrett: Views, Opinions and Experience ","Everybody Expects the Anti-Catholic Inquisition","What Kind of Judge Is Amy Coney Barrett?","New York State Tops 1,000 New Virus Cases for First Time Since Early June","During Coronavirus, Every Day Is Take Your Daughter to Work Day","What Equal Opportunity in the Workplace Means","Xi Says China Will Continue Efforts to Assimilate Muslims in Xinjiang ","New York City Rehearsal Spaces Reopen Despite State Restrictions","Everybody vs. the App Store: Why Companies Are Taking Issue With Apple’s Growing Revenue Engine ","In Baseball’s Pandemic Playoffs, the Schedule Could Decide the Pennant ","How WFH Sweatpants Gave Way to Thong Bikinis","Google Will Be Hard Habit to Break ","Biden Holds Bigger September Poll Lead Than Clinton Did ","TikTok’s Fate Coming to a Head","Breonna Taylor Case Prosecutor Known as Republican to Watch","Where Trump and Biden Stand on Trade","How Radiohead Predicted Our Tumultuous Times 20 Years Ago","‘Jacob Lawrence: The American Struggle’ Review: Fiercely Painted Histories","Unhappy With Your Old Life? Pandemic Frees Formerly Office-Bound Workers to Experiment With New Ones","Most Popular News","Recommended Videos","Most Popular News","Recommended Videos","Most Popular News","Recommended Videos","Most Popular News","Recommended Videos","Most Popular News","Recommended Videos","Most Popular News","Recommended Videos","Most Popular News","Recommended Videos","Most Popular News","Recommended Videos","Most Popular News","Recommended Videos","Most Popular News","Recommended Videos","Most Popular News","Recommended Videos","Most Popular News","Recommended Videos","Most Popular News","Recommended Videos","Most Popular News","Recommended Videos","Most Popular News","Recommended Videos","Most Popular News","Recommended Videos","Most Popular News","Recommended Videos","Most Popular News","Recommended Videos","Most Popular News","Recommended Videos","Most Popular News","Recommended Videos","Most Popular News","Recommended Videos","Most Popular News","Recommended Videos","Most Popular News","Recommended Videos","Most Popular News","Recommended Videos","Most Popular News","Recommended Videos","Most Popular News","Recommended Videos","Most Popular News","Recommended Videos","Most Popular News","Recommended Videos","Most Popular News","Recommended Videos","Most Popular News"
"X.117","2020/09/27","Chinese Property Developer Decries Fabricated Documents After Selloff","Judge Halts Trump Administration TikTok Download Ban","Corrections &
		
	Amplifications","Trump Declines to Say How Much He Has Paid in Federal Income Taxes ","Kioxia Calls Off $16 Billion IPO After Huawei Fallout ","The Importance of Amy Coney Barrett","Trump’s Nomination of Barrett Heightens Partisan Conflict as Election Nears ","New York’s Third-Party Candidates Aim for Survival ","Bankrupt Gun Maker Remington Outdoor to Be Broken Up and Sold ","Devon Energy, WPX in Talks to Merge","Trump, Biden Prepare for Debate on Coronavirus, Supreme Court Fight ","NYC Mayor’s Advisory Council Warned of Teacher Shortage Four Months Ago ","The GOP’s ObamaCare Self-Sabotage","New York City Principals Union Calls On Mayor to Cede Control of Schools to State","Some States Loosen Dining Restrictions Despite Rising Coronavirus Cases","U.S. Warns Iraq It Is Preparing to Shut Down Baghdad Embassy","Trump Can Take Credit for Vaccine Progress but Shouldn’t Rush It","Landlords Have Bills Too","‘It Ain’t Braggin’ if You Can Back It Up’","Florida and the Cuban Vote","‘The Doctor Who Fooled the World’ Review: Vax Populi","Notable & Quotable: Noah Feldman, a Liberal for Amy Coney Barrett","Microsoft’s Brand Chief on Working With the NFL During Covid ","Lebanon’s Prime Minister-Designate Resigns, Deepening Country’s Political Crisis ","Economy Week Ahead: Factories, Consumer Spending and Employment ","One Woman’s Journey From New York Bond Trader to Orthodontist","Covid Amplified Pre-Existing Hospital Ills","The High Cost of a Free College Education","End of Race Preferences Led To More Minority Graduates","Taiwan, People’s Republic Currencies Are Separate","Some Travelers Miss Flying So Much, They’re Taking Planes to Nowhere    ","NYPD Officer Accused of Spying Puzzled New York’s Tibetan Groups","Armenia and Azerbaijan Clash Over Disputed Region ","Commerzbank Appoints Deutsche Bank’s Manfred Knof as CEO","Coronavirus Spreads Deep Into the Amazon, Imperiling an Ancient Tribe","Grocers Stockpile, Build ‘Pandemic Pallets’ Ahead of Winter","Amazon’s Alexa Boss on What Users Are Asking During Covid-19 ","Trump, Biden Have Few Americans to Persuade in Debates","Eric Schmidt’s Daughter Has Tech Ambitions—Just Not in Silicon Valley","Time’s Up CEO Tina Tchen Fights for Workplace Equality. Covid-19 Makes That Job Harder. ","China’s Export Machine Looks Inward as Global Risks Rise ","Bonds Are Beating Stocks in Topsy-Turvy 2020 ","AirPods Pro Are Even Better a Year Later ","Wanted in Covid-19 Fight: ‘Superdonors’ of Convalescent Plasma ","Captive Insurance Seen as Covid-Era Remedy to Rising Premiums ","Sustainable Footwear Maker Allbirds Lands $100 Million in Funding","Teachers Find Higher Pay and Growing Options in Covid Pods","Photos of the Week","Europe Invites a Trade Battle in its Fight Against Shipping Pollution ","Roland-Garros Prepares to Plow Through Europe’s Second Wave","Most Popular News","Recommended Videos","Even in Streaming TV, Advertisers Are Dealing With Fraud ","Chinese Companies Head Home to Raise Money, as Beijing’s Relations With U.S. Fray","Investors Ramp Up Bets on Market Turmoil Around Election","Pakistan Top Court to Rule on Conviction in WSJ Reporter’s Murder ","Most Popular News","Recommended Videos","Even in Streaming TV, Advertisers Are Dealing With Fraud ","Chinese Companies Head Home to Raise Money, as Beijing’s Relations With U.S. Fray","Investors Ramp Up Bets on Market Turmoil Around Election","Pakistan Top Court to Rule on Conviction in WSJ Reporter’s Murder ","Most Popular News","Recommended Videos","Even in Streaming TV, Advertisers Are Dealing With Fraud ","Chinese Companies Head Home to Raise Money, as Beijing’s Relations With U.S. Fray","Investors Ramp Up Bets on Market Turmoil Around Election","Pakistan Top Court to Rule on Conviction in WSJ Reporter’s Murder ","Most Popular News","Recommended Videos","Even in Streaming TV, Advertisers Are Dealing With Fraud ","Chinese Companies Head Home to Raise Money, as Beijing’s Relations With U.S. Fray","Investors Ramp Up Bets on Market Turmoil Around Election","Pakistan Top Court to Rule on Conviction in WSJ Reporter’s Murder ","Most Popular News","Recommended Videos","Even in Streaming TV, Advertisers Are Dealing With Fraud ","Chinese Companies Head Home to Raise Money, as Beijing’s Relations With U.S. Fray","Investors Ramp Up Bets on Market Turmoil Around Election","Pakistan Top Court to Rule on Conviction in WSJ Reporter’s Murder ","Most Popular News","Recommended Videos","Even in Streaming TV, Advertisers Are Dealing With Fraud ","Chinese Companies Head Home to Raise Money, as Beijing’s Relations With U.S. Fray","Investors Ramp Up Bets on Market Turmoil Around Election","Pakistan Top Court to Rule on Conviction in WSJ Reporter’s Murder ","Most Popular News","Recommended Videos","Even in Streaming TV, Advertisers Are Dealing With Fraud ","Chinese Companies Head Home to Raise Money, as Beijing’s Relations With U.S. Fray","Investors Ramp Up Bets on Market Turmoil Around Election","Pakistan Top Court to Rule on Conviction in WSJ Reporter’s Murder ","Most Popular News","Recommended Videos","Even in Streaming TV, Advertisers Are Dealing With Fraud ","Chinese Companies Head Home to Raise Money, as Beijing’s Relations With U.S. Fray","Investors Ramp Up Bets on Market Turmoil Around Election","Pakistan Top Court to Rule on Conviction in WSJ Reporter’s Murder ","Most Popular News","Recommended Videos","Even in Streaming TV, Advertisers Are Dealing With Fraud ","Chinese Companies Head Home to Raise Money, as Beijing’s Relations With U.S. Fray","Investors Ramp Up Bets on Market Turmoil Around Election","Pakistan Top Court to Rule on Conviction in WSJ Reporter’s Murder ","Most Popular News","Recommended Videos","Most Popular News","Recommended Videos","Most Popular News","Recommended Videos","Most Popular News"
