"X.78","2020/08/19","Michigan to Pay $600 Million in Flint Water Crisis Settlement","Insurance Executive Greg Lindberg Sentenced to Seven Years and Three Months in Prison ","Fed Minutes to Shed Light on Central Bank Strategy Review","Trump Praises QAnon Followers as ‘People That Love Our Country’ ","Facebook Removes QAnon Groups","U.S. Risks Diplomatic Isolation With Bid to Reimpose U.N. Sanctions on Iran","Senate Report Faults FBI’s Handling of 2016 Election Probes","Amtrak Blamed for Cost Overruns for New York’s Moynihan Station ","Target Posts Record Growth as Pandemic Fuels E-Commerce","Airbnb Files Confidentially for IPO With SEC ","California’s Green Blackouts","The Russian Grassy Knoll","Venezuela’s Human Bargaining Chips","Bayern Munich Cruises Into Champions League Final ","Kamala Harris and the Anarchists","Why Would States Limit Hospital-Bed Supply?","Joe Biden Revives the Four-Corners Offense","After Tragedy in Beirut, End Lebanon’s U.N. Farce","The Postal Service Democrats","‘Promised Land’ Review: A Short-Lived Consensus","Crackdown on Gun Crime Has Brought 1,400 Arrests So Far","Trump Calls for Goodyear Boycott Over Ban on Campaign Attire","Scotiabank Fined $127 Million for Price Manipulation, False Statements ","Nvidia Posts Record Sales as Pandemic Sustains Chip Demand ","Political Conventions Went Stale Before They Went Virtual","U.S. Won’t Pursue Death Penalty Against Two Islamic Militants, Justice Department Tells British","Fed Sees Need for Additional Support but Is Vague on Timing","New Jersey Supreme Court Curbs Power of Newark’s Police Oversight Board  ","John Kerry’s Fantasy World","John Ford’s First Rodeos","Company Write-Downs Surge as Business Slows During Covid-19 ","New U.S. Covid-19 Cases Jump as Fears Grow Over Campus Spread","Postal Delivery Delays Trouble E-Commerce Sellers","The Latest Pain Trade on Wall Street: Banks","U.S. Stocks Slip After S&P 500’s Record Close","Apple Surges to $2 Trillion Market Value","Next Steps on Coronavirus Stimulus Divide Both Parties ","Offshore Drilling Contractor Valaris Files for Bankruptcy in the U.S. ","Joe Biden’s Aviators: A Fashion (and Political) Statement","Traders Accused of Market Manipulation Allege Misconduct by Prosecutors ","Wildfires Tear Across California ","After Mali Coup, Mutineers Pledge Fresh Elections","Retailers See E-Commerce Investments Pay Off Big as Coronavirus Keeps Shoppers Home","Apple at $2 Trillion Leaves No Room for Error ","Fund’s Woes Highlight Risks Lurking in Commodity ETFs ","New York Teachers Union Threatens Strike if Schools Reopen Without Safety Measures","Publisher’s Report and Objective Journalism","There’s Little Democratic Center Left to Hold","‘Sam Gilliam’ Review: Flowing Color, Billowing Canvas","‘Socialism Is Another Name for Disaster’","Most Popular News","Recommended Videos","A Medieval Manor West of London Lists for $6.55 Million","A Medieval Manor in Modern Times","On The Grounds of Cothay Manor","What to Watch: On Disney+ ‘The One and Only Ivan,’ a Star-Studded Live-Action Family Drama ","New York State Should Brace for Second Wave of Coronavirus Cases","Copper Prices Rise Above $3 Amid Growth Hopes ","Judge Rules Video of Robert Kraft in Massage Parlor Was Taken Illegally","Uber and Lyft Threaten California Shutdown: Here’s What’s at Stake ","LeBron James and the Lakers Wear Modified MAGA Hats for Breonna Taylor","How Women’s Suffrage Changed America Far Beyond the Ballot Box","Black Women Share Experiences of Discrimination in the Wine Industry","It’s Time to Update Your Boring Covid-Era Sneakers","Senators Warn Trump Saudi-Chinese Uranium Plant Risks Spread of Nuclear Weapons ","Long Power Outages After Isaias Spark Calls to Overhaul Utilities","Citi Widens Hunt for Revlon Loan Payments","Wary of Treading on Russia’s Toes, Europe Plans Targeted Sanctions Against Belarus Officials ","Fundraising at Company Tied to Steve Bannon and Guo Wengui Faces Probe","At Home Depot and Lowe’s, Home-Improvement Splurge Can Go On ","Your Covid Gray Hair? It’s Here to Stay ","Lowe’s Online Quarterly Sales More Than Doubled","The Left Still Blames America First","Activism Is for Adults","Johnson & Johnson to Buy Momenta Pharmaceuticals for $6.5 Billion","Democrats’ Virtual Convention Means Comfort, Convenience and Inclusion","Trudeau Says He Initially Balked at Contract Award ","Nintendo’s ‘Animal Crossing’ Goes Upscale With Museum Masterpieces ","Biotech Is Priced for Bad Reactions ","A $60 Million Orange County Mansion Could Break the Area’s Price Record","A Massive Mansion Overlooking the Pacific","Gidget Made This Malibu Surf Spot Famous. Not Much Has Changed.","Colleges Scramble to Contain Coronavirus as They Open Campuses","Intellectual-Property Assets Are Getting More Valuable ","U.S.-China Trade Talks Delayed, Not Derailed","Chris Froome Left Off Tour de France Squad","The Maker of the Taser Won’t Be Defunded    ","DNC Guide: Joe Biden’s Speech, Schedule, Speakers and How to Watch","Maersk Quarterly Profit Triples on Rising Freight Rates, Falling Costs ","Covid-19 Appeared to Be Under Control in Europe. Now It’s Surging Again.","Why Republicans Are Speaking at the Democratic Convention ","Joe Biden United the Democrats—It’s Not Likely to Last","Supreme Court Chief Justice John Roberts Is Pivot in Coronavirus Cases","Fund Managers Say Bring On the Double Dip","In Baseball, Breaking Coronavirus Protocols Could Cost Millions","Players Are Testing Positive for a 50-Year-Old Steroid. They Can’t Explain Why.","TikTok: Can the Over-30 Crowd Safely Ignore It?","Premium Retailers Ride China’s Recovery","Apps Serve Professionals Distanced Networking With Novel Twists ","Character, National Security Dominate on Night Democrats Nominate Joe Biden","Ross Spano Becomes Eighth House Lawmaker Defeated in Primaries","Gardening as a Radical Act","Most Popular News","Recommended Videos","The Latest Project to Preserve Pompeii Reveals New Treasures","Damian Lillard Is the Longest Shot in the NBA","Berlin Highway Crash Is Investigated as a Terrorist Attack ","Good Grounds for American Exceptionalism in Stocks","Purses Are Out. Fanny Packs Are In.","NIH Presses U.S. Nonprofit for Information on Wuhan Virology Lab","Some States Are Pushing Laws to Restrict Police Behavior "
"X.79","2020/08/20","The Joe Biden We Know","The Democrats Miss the Meaning","Former Pemex CEO’s Allegations Rock Mexico’s Political Class","U.S. Justice Department Seeks Death Sentence for Boston Bomber ","Iraq’s Kadhimi, Trump Sidestep Setting Deadline for Withdrawing U.S. Troops From Iraq ","The Oracle of Trump","Iraq’s Kadhimi Opportunity","How to Set World Trade Straight","Meet Canada’s ‘Minister of Everything’","The Obama-Biden Virus Response","Harris vs. the Knights of Columbus","‘And in the End’ Review: Band on the Run","Bannon Charged in Alleged Border-Wall Fundraising Scheme","Facebook’s Zuckerberg Questioned in FTC Antitrust Probe","Michaels Hires Pizza Hut U.S. CFO as Finance Chief","Lyft, Uber Get More Time as They Fight California Order","A Ferocious Phillies Fan at Fenway","U.S. Allies Reject Bid to Reinstate Iran Sanctions, Opening Diplomatic Rift ","Time to Address Fundamental USPS Reform","Beating Addiction, Going Beyond One’s Self","Hopeful but Not Optimistic About a Biden Stock Boom","Maybe It’s Time to Examine Your Voting Assumptions","Michigan to Pay $600 Million to Flint Residents","California Wildfires Rage Despite Break in Heat Wave ","U.S. Coronavirus Deaths Top 173,000","New York Schools Chief Warns of Teacher Layoffs if State Cuts Aid ","Volkswagen Notches Early Win in Legal Fight With SEC","Former Uber Security Chief Charged Criminally in Connection With 2016 Hack ","‘Maybe I Should Go to Jail.’ Neiman Investor Slammed in Government Report ","‘Desert One’ Review: Heroism and Heartbreak","U.S. Stocks Edge Higher, Led by Tech Shares","‘The King and I’ Review: Something Wonderful, on the Small Screen","‘Family Business’ Review: Of Law and Relationships","Engaged Capital Targets Evolent Health","CBS Seeking Over $5 Million for 2021 Super Bowl Ads","‘Coup 53’ Review: A Long Arc of Middle East History","Clinton ‘Really Meant It’","Buyout Firm EQT’s Stock Slumps as Earnings Disappoint ","Putin Rival Alexei Navalny in Critical Condition After Suspected Poisoning","Another Putin Critic Falls Ill","Sen. Bill Cassidy Tests Positive for Covid-19 ","Bayer Settles Essure Birth-Control Litigation for $1.6 Billion","Extended Montreal Dock Workers’ Walkout Rattles Canadian Supply Chains","U.S. Colleges Are Taking Steps to Protect Students From China’s National-Security Law","News Publishers Join Fight Against Apple Over App Store Terms ","J&J Plans Pivotal Trial for Covid-19 Vaccine ","LeBron James, Lakers Make a Statement With Breonna Taylor Hats","Bestselling Books Week Ended August 15","Nvidia’s Switch Hit ","New York Lawmakers Urge Utilities to Overhaul Practices Following Outages ","Most Popular News","Recommended Videos","Florida Charges Guggenheim Insurance Chief for Role in Boat Crash","Trump Asks Supreme Court to Restore Ability to Block Twitter Followers ","Back to School: Everything Kids Need to Succeed at Virtual Learning","Here’s How to Financially Prepare for Returning to Work or College","Does Robinhood’s Design Make Trading Too Easy? ","Possible F-35 Jet Sale to U.A.E. Puts Israel in Bind ","Justice Department’s Antitrust Chief Plans Shake Up ","Covid-19 Data Will Once Again Be Collected by CDC, in Policy Reversal","Pentagon Approves Five Drone Makers for Military Sales ","From Jimi Hendrix to Colin Kaepernick, the Afro as Rebellion","Former House Speaker Paul Ryan Starts Blank-Check Company ","Why Jumbo Mortgage Rates Make No Sense Right Now","Islamist Attacks in Mozambique Threaten to Disrupt Total-Led Natural-Gas Project ","What Kamala Harris Isn’t Saying About Her Mother’s Background","A Virtual Convention? At Least There Are No Stink Bombs","U.S. Sanctions Syrian Ex-TV News Anchor, Others in Bid to Pressure Assad ","Economic Recovery Is Hardly in the Bag ","Green-Energy Shares Rise Along With Joe Biden’s Polling","Rewards for Giving to Charity","Iran Unveils New Missiles, Improving Its Reach at Sea and to Israel ","Trump Must Release His Tax Returns to Manhattan Prosecutors, Judge Rules","Silicon Valley and Wall Street Elites Pour Money Into Psychedelic Research ","To Build a Plane That Can Fly Itself, Start With a Pilot in the Cockpit","U.S. Jobless Claims Rose to 1.1 Million in Latest Week","American Airlines to Cut Service to Small Cities","Reopening Schools Is So Complicated, New York Is Struggling to Schedule Classes ","Jack Ma’s Ant Group Produces $3.5 Billion Profit in Six Months as IPO Looms","Covid-19 Pounds NYC Real Estate Worse Than 9/11, Financial Crash","Luxury Real Estate Rides Out The Pandemic","Tesla Owners Can Find Their Electric Flame ","Why You Should Never Buy Camping Gear Again","Mounting Debt Threatens to Derail New York Transit System","Alibaba’s Online Orders Soar During Coronavirus, Fueling a Sales Recovery","Holy Bleep! Curse Word Surge Torments Baseball, Other Sports","Kodak’s $765 Million Moment: How It Happened and How It Went Wrong","The Pleasure and Pain of Scientific Predictions","Guilty Plea Entered in PdVSA Corruption Investigation ","Chrissy Teigen and John Legend List Beverly Hills Home for $23.95 Million","John Legend and Chrissy Teigen’s Beverly Hills Home","Mexico City, Struggling to Provide Clean Water, Tests a New Method","Marcel Adams Escaped Forced Labor, Thrived in Real Estate ","Flooding Pounds China’s Three Gorges Dam ","Inside the Rise of Mohammed bin Salman ","Covid Is No Excuse for Grand Jury Duty When You Can Serve From Your Bedroom","Itching to Travel? Attend These Music and Film Festivals—Online","This Stock Could Be a Real Kitchen Nightmare","A Hidden Winner in the Covid-19 Rush to Upgrade Warehouses ","Battered Eurozone Could See More Stimulus in the Fall","DNC: Four Key Takeaways From Night Three    ","Lance Armstrong, Ryan Lochte and the Marketing of Controversy","Most Popular News","Recommended Videos","Biden to Seek Emotional Connection in Virtual Speech to DNC    ","Baseball’s Best Young Player Swings on 3-0. Here’s Why Everyone Should.","Red Flags Point to Faltering Recovery in Oil","As Covid-19 Symptoms Linger, Demand for Specialized Clinics Surges","South Korea’s Male-Dominated Workplaces in Spotlight After Sexual Harassment Accusations","Turkey Keeps Rates Unchanged Even as Lira Plumbs Record Lows","Twitter Data Case Sparks Dispute, Delay Among EU Privacy Regulators"
"X.80","2020/08/21","Mexican President Faces Hard Questions Over Videos of Brother ","Lawsuit Claims U.S. WeChat Ban Is Unconstitutional","Why Are There Still Not Enough Paper Towels?","Seattle Mayor Vetoes City Budget That Proposed Cuts to Police ","Peter Thiel’s Palantir Shows Steep Losses, and Some Hope, Ahead of Listing ","David Pecker, CEO of National Enquirer’s Parent, Steps Down","Democratic Convention Draws Over 24.6 Million Viewers as Biden Accepts Nomination","Trump Holds Private Funeral for His Brother at White House ","Lowe’s, Oracle, American Airlines: Stocks That Defined the Week","Joe Biden’s Me-Too Covid Plan","The Battle Over Snapback Sanctions","Texas-Based Driller Arena Energy Files for Bankruptcy","A Mail-Voting Redo in New Jersey","Counting the Cost of Britain’s Lockdown","‘The Churchill Complex’ Review: Anglo-American Attitudes","‘A Dominant Character’ Review: The Most Problematic Polymath","Colleges Worried About Covid-19 Cases Tell Students to Stop Partying","Covid-19 Pay Cuts Are Coming to an End at Some Companies ","SEC Boosting Privacy for Big Market-Surveillance Database ","New Coronavirus Cases Below 50,000 in U.S. for Sixth Straight Day","Lori Loughlin Sentenced to Two Months in College-Admissions Scandal","The Normalcy of Trump’s Republican Party","Covid Summer Drew This Tourist off the Beaten Path","‘The Habsburgs: To Rule the World’ Review: An Ideal Empire","The Last Race Card?","Democrats Make This Nonnative Restless","Home-Improvement Stocks Stay the Course Amid Nesting During Covid-19","California Wildfires Continue to Rage Across State","Vista Equity’s Robert Smith Under Federal Tax Probe","S&P 500 Notches Longest Weekly Winning Streak of 2020","Some Chicago Residents Are Clashing With Protesters Over Defunding Police","Big Theater Chains Tout Safe-Moviegoing Measures ","Home Sales Reach Lofty Heights","Staff Press Facebook to Change Policies on India Hate Speech","Natural Gas Prices Are on Fire, but Producers Are Holding Back","Facebook CMO Antonio Lucio to Exit ","FDA’s Authority to Regulate Lab Tests Is Curtailed ","Lawmakers Urge More Lending to U.S. Firms Hit by Coronavirus Fallout ","Harvard Board Gains Backers of Fossil Fuel Divestment","After Democrats Nominate Biden, Spotlight Shifts to Trump, RNC","How ‘Sticky’ Are Those Biden Republicans?","A Prime Minister-Like President: Good Idea","Kamala Flunks Article VI’s No Religious Test Provision","Capital-Gains Rate Matters To Non-Wealthy Americans","Postmaster General Louis DeJoy Defends Changes Before Senate Committee ","Lifestyles of the Rich and Populist","Curtiss-Wright Discloses Possible Russia Sanctions Violations ","Israel and U.A.E. Get Down to Business ","A New Look at Germany’s Jewish Past","Biden Plans to Cancel a Big Portion of Student Loan Debt","Most Popular News","Recommended Videos","After the Beirut Explosion, Volunteers Step Up to Do What the Government Can’t ","Three Warming Cocktails for Covid-Era Fall Entertaining","Is It Safe to Stay in a Luxury Resort Right Now?","Europe Lifts Tariffs on U.S. Lobsters ","Amazon’s Deep Bench Still Leaves Key Man Risk ","‘Trojan Horse’: A Strategy That Keeps Hiding in Plain Sight","A Monument of Titanic Beauty","U.S. Economic Recovery Gains Steam While Others Stutter","SUNY’s Next Chancellor is Longtime Cuomo Aide","Biden Unmasked","Los Angeles City Attorney Files Charges in May Building Explosion","Libya’s Rival Governments Declare Cease-Fire ","Hedge Fund Marble Ridge to Close After Scathing Neiman Report ","Montreal Dock Workers Reach Agreement to End Port Strike","How Covid-19 Changed the Way Government Collects Data","Jeff Wilke, Confidant of Amazon’s Founder, Plans to Retire","Liu Cixin Writes Science Fiction Epics That Transcend the Moment","Billions in Federal Covid-19 Testing Funds Still Unspent ","‘I Want to Be With Her.’ When Covid Closed Nursing Homes, One Husband Moved In","Turkey Looks to Vast Gas Discovery to Bolster Ailing Economy ","Runners Are Still Racing Marathons—From Their Local Parking Lots","The Woman Behind Facebook’s Billion-Dollar Balancing Act","How Trump Has Changed the Republicans","Democrats Nominate Biden, as Trump Hangs Over Their Show ","Five Best: Nicholas A. Basbanes on the American Renaissance Poets","Covid-19 Crisis in Nursing Homes Requires Aggressive Federal Response, Panel Says ","‘The Craft’ Review: On the Level and on the Square","Fiction: A Life as Interesting as a Novel","‘Summer’ Review: State of the Union","‘Robert Conquest: Collected Poems’ Review: The Impervious Dream","Mysteries: Big Bangs in the Big Apple","Children’s Books: Disturbing Portents and Magical Powers","‘The Western: Four Classic Novels of the 1940s & 50s’ Review: Under Western Eyes","Cesare Romiti Took On Fiat Unions, Revived Car Maker’s Fortunes ","Chemist Worked for Cleaner Drinking Water World-Wide ","Payment Giant’s Directors Take Some Money off the Table ","Argentines Seek Safety of U.S. Dollars, Despite Debt Deal ","2020 Corvette Stingray: America’s Supercar Gets a European Makeover","Small-Business Owners: Don’t Forget Special Pandemic Tax Breaks","Pitney Bowes Is Unboxing E-Commerce Bonanza","Today’s Logistics Report: Fighting for a Port; Strife on Docks; Accelerating Technology ","State Department Urges Universities to Disclose China Stocks in Index Funds ","Trump Campaign’s Hopes Rest on Boosting White Working-Class Turnout ","DNC: Four Key Takeaways From Night Four ","Novelist Hari Kunzru Tumbles Down the Rabbit Hole of Extremism","South Korea’s Coronavirus Return Looks Familiar, With a Church at the Center","Coronavirus Is Turning College Football Into Football Without College","Under the Surface of Pristine Job Numbers, Pain Awaits Europe Too ","Push to Defund the Police Faces Headwinds in Some Poor, Black Neighborhoods ","Facebook Staff Demand Policy Changes on India Hate Speech ","Most Popular News","Recommended Videos","Student Loan Borrowers Would See a Big Chunk of Debt Disappear Under Biden Plan ","Discount Retailers Test Investors’ Patience","Uber and Lyft’s Platform Premium Already Waned","When the Stock Market and Economy Seem Disconnected","It’s PSG-Bayern Munich in Final. But the Memory of Barcelona Lingers.","Online Betting Is On a Roll. Time to Cash In Some Chips.","Voting by Mail? These Companies Are Rushing to Print Your Ballot"
"X.81","2020/08/22","Two Tropical Storms Pose Double Threat to U.S. Gulf Coast","Even With a Strong Crop This Year, U.S. Farmers Are Suffering ","House Passes Emergency Bill to Halt Immigration-Agency Cuts ","House Passes Bill Bolstering Postal Service With $25 Billion","TikTok Plans to Challenge President Trump’s Executive Order","California Wildfires Grow to Second and Third Largest in State History","U.S. Rep. Meuser Tests Positive for Covid-19 ","Army Corps to Ask for More Protection Measures for Alaska Mine Project ","Two Dead, Two Still Missing After Pipeline Explosion at Texas Port","Former CIA Director Brennan Is Not Target of 2016 Election Probe ","Putin Critic Alexei Navalny Evacuated to Germany ","Iowa Continues Cleanup, Recovery Nearly Two Weeks After Derecho","Three Questions With Bluemercury’s Marla Beck","Secondhand Sellers Have Problems, but Demand Isn’t One","New York City Museums Ready to Reopen, but Some See Unclear Future ","As Covid-19 Clobbers Tourism, Millions Lose a Lifeline       ","This Market Is a Tech Market. If Bond Yields Rise, Watch Out. ","Is an Employee Who Quits Because of Health Concerns Eligible for Unemployment Benefits?","Mortgage Fee Aims to Bolster Fannie, Freddie Ahead of Possible Sale","A Roaming Picasso Pilgrimage","A Shoulder Workout for Professional Baseball Players—and Workers Hunched at Their Desks ","Coronavirus Further Complicates Shell’s Giant Floating Gas Project ","South African Wine Makers Bruised by Coronavirus Alcohol Bans","Navalny Arrives in Germany From Siberian Hospital","Covid-19 Is Dividing the American Worker","An AI Breaks the Writing Barrier","Make the Most of Your Patio All Fall and Winter: An Outdoor Décor Guide","The Ultimate WFH Jacket? A Bathrobe Reborn as a Blazer","Pepper...and Salt","The Other Pandemic: Corporate Hacking Attempts","New Coronavirus Cases Below 50,000 in U.S. for Seventh Straight Day","Most Popular News","Recommended Videos","Two Tropical Storms Pose Double Threat to U.S. Gulf Coast","Even With a Strong Crop This Year, U.S. Farmers Are Suffering ","House Passes Emergency Bill to Halt Immigration-Agency Cuts ","House Passes Bill Bolstering Postal Service With $25 Billion","TikTok Plans to Challenge President Trump’s Executive Order","California Wildfires Grow to Second and Third Largest in State History","U.S. Rep. Meuser Tests Positive for Covid-19 ","Army Corps to Ask for More Protection Measures for Alaska Mine Project ","Two Dead, Two Still Missing After Pipeline Explosion at Texas Port","Former CIA Director Brennan Is Not Target of 2016 Election Probe ","Putin Critic Alexei Navalny Evacuated to Germany ","Iowa Continues Cleanup, Recovery Nearly Two Weeks After Derecho","Three Questions With Bluemercury’s Marla Beck","Secondhand Sellers Have Problems, but Demand Isn’t One","New York City Museums Ready to Reopen, but Some See Unclear Future ","As Covid-19 Clobbers Tourism, Millions Lose a Lifeline       ","This Market Is a Tech Market. If Bond Yields Rise, Watch Out. ","Is an Employee Who Quits Because of Health Concerns Eligible for Unemployment Benefits?","Mortgage Fee Aims to Bolster Fannie, Freddie Ahead of Possible Sale","Most Popular News","Recommended Videos","Most Popular News","Recommended Videos","Most Popular News","Recommended Videos","Most Popular News","Recommended Videos","Most Popular News","Recommended Videos","Most Popular News","Recommended Videos","Most Popular News","Recommended Videos","Most Popular News","Recommended Videos","Most Popular News","Recommended Videos","Most Popular News","Recommended Videos","Most Popular News","Recommended Videos","Most Popular News","Recommended Videos","Most Popular News","Recommended Videos","Most Popular News","Recommended Videos","Most Popular News","Recommended Videos","Most Popular News","Recommended Videos","Most Popular News","Recommended Videos","Most Popular News","Recommended Videos","Most Popular News","Recommended Videos","Most Popular News","Recommended Videos","Most Popular News","Recommended Videos","Most Popular News","Recommended Videos","Most Popular News","Recommended Videos","Most Popular News","Recommended Videos","Most Popular News","Recommended Videos","Most Popular News","Recommended Videos","Most Popular News","Recommended Videos","Most Popular News","Recommended Videos","Most Popular News","Recommended Videos","Most Popular News"
